{
  "schema_version": 1,
  "target": {
    "jurisdiction": "132047",
    "fiscal_year": 2022,
    "document_kind": "supplementary",
    "amendment_number": 7
  },
  "direction": "expenditure",
  "tables": [
    {
      "table_id": "mitaka-supplementary-native-cbd7ed049227ad45",
      "raw_path": "mitaka-supplementary-native/jurisdiction=132047/year=2022/document_kind=supplementary/edition=39005886ea557b24ac22b7fc4d849bab96795a82d0932cfe699a51321281512d/direction=expenditure/table=supplementary-7-pages-24-35-left_setsu_delta/data.parquet"
    },
    {
      "table_id": "mitaka-supplementary-native-8a3b5317d03a2ba4",
      "raw_path": "mitaka-supplementary-native/jurisdiction=132047/year=2022/document_kind=supplementary/edition=39005886ea557b24ac22b7fc4d849bab96795a82d0932cfe699a51321281512d/direction=expenditure/table=supplementary-7-pages-24-35-left_setsu_observations/data.parquet"
    },
    {
      "table_id": "mitaka-supplementary-native-3c52a078410bbbaf",
      "raw_path": "mitaka-supplementary-native/jurisdiction=132047/year=2022/document_kind=supplementary/edition=39005886ea557b24ac22b7fc4d849bab96795a82d0932cfe699a51321281512d/direction=expenditure/table=supplementary-7-pages-24-35-project_delta/data.parquet"
    },
    {
      "table_id": "mitaka-supplementary-native-3056a4aa4ce34ecc",
      "raw_path": "mitaka-supplementary-native/jurisdiction=132047/year=2022/document_kind=supplementary/edition=39005886ea557b24ac22b7fc4d849bab96795a82d0932cfe699a51321281512d/direction=expenditure/table=supplementary-7-pages-24-35-project_observations/data.parquet"
    }
  ]
}
