{
  "schema_version": 1,
  "target": {
    "jurisdiction": "131016",
    "fiscal_year": 2025,
    "document_kind": "supplementary",
    "amendment_number": 1
  },
  "direction": "expenditure",
  "tables": [
    {
      "table_id": "chiyoda-supplementary-native-9ed82f0f95fb90ac",
      "raw_path": "chiyoda-supplementary-native/jurisdiction=131016/year=2025/document_kind=supplementary/edition=79b56968859ef18ea6b94f33c37b816d9c737f2b3b9b1018d8902cba79ac64fc/direction=expenditure/table=separate-printed-decompositions/data.parquet"
    }
  ]
}
