{
  "schema_version": 1,
  "target": {
    "jurisdiction": "132241",
    "fiscal_year": 2025,
    "document_kind": "supplementary",
    "amendment_number": 13
  },
  "direction": "expenditure",
  "tables": [
    {
      "table_id": "tama-supplementary-native-8ea6c57edb0e0b9c",
      "raw_path": "tama-supplementary-native/jurisdiction=132241/year=2025/document_kind=supplementary/edition=f4b7f64956c58812232cbc8b713cdb5a393b82d95109c5c6ad75f8fe95eddb9a/direction=expenditure/table=supplementary-13-pages-10-13-observations/data.parquet"
    },
    {
      "table_id": "tama-supplementary-native-da9ea396f9f88426",
      "raw_path": "tama-supplementary-native/jurisdiction=132241/year=2025/document_kind=supplementary/edition=f4b7f64956c58812232cbc8b713cdb5a393b82d95109c5c6ad75f8fe95eddb9a/direction=expenditure/table=supplementary-13-pages-10-13-expenditure/data.parquet"
    }
  ]
}
