{
  "schema_version": 1,
  "target": {
    "jurisdiction": "132241",
    "fiscal_year": 2024,
    "document_kind": "initial"
  },
  "direction": "expenditure",
  "tables": [
    {
      "table_id": "raw-962f0d0cd7735a4a",
      "raw_path": "jurisdiction=132241/year=2024/document_kind=budget/edition=085be12b1a0682d1d45bad5b97bc5390e8318f0933029b6bccd04beccccd458a/direction=expenditure/data.parquet"
    }
  ]
}
