{
  "schema_version": 1,
  "target": {
    "jurisdiction": "132047",
    "fiscal_year": 2021,
    "document_kind": "supplementary",
    "amendment_number": 12
  },
  "direction": "expenditure",
  "tables": [
    {
      "table_id": "mitaka-supplementary-native-1f6b0fd53f187651",
      "raw_path": "mitaka-supplementary-native/jurisdiction=132047/year=2021/document_kind=supplementary/edition=11dcb5d3c2fc32edc837fbbdb572c6568c4fdf401b3ce922cbdfdb21b6f3132e/direction=expenditure/table=supplementary-12-pages-16-17-left_setsu_delta/data.parquet"
    },
    {
      "table_id": "mitaka-supplementary-native-c3576edb45e41ccd",
      "raw_path": "mitaka-supplementary-native/jurisdiction=132047/year=2021/document_kind=supplementary/edition=11dcb5d3c2fc32edc837fbbdb572c6568c4fdf401b3ce922cbdfdb21b6f3132e/direction=expenditure/table=supplementary-12-pages-16-17-left_setsu_observations/data.parquet"
    },
    {
      "table_id": "mitaka-supplementary-native-26965f1ee52892da",
      "raw_path": "mitaka-supplementary-native/jurisdiction=132047/year=2021/document_kind=supplementary/edition=11dcb5d3c2fc32edc837fbbdb572c6568c4fdf401b3ce922cbdfdb21b6f3132e/direction=expenditure/table=supplementary-12-pages-16-17-project_delta/data.parquet"
    },
    {
      "table_id": "mitaka-supplementary-native-ea86f2460bb00cdb",
      "raw_path": "mitaka-supplementary-native/jurisdiction=132047/year=2021/document_kind=supplementary/edition=11dcb5d3c2fc32edc837fbbdb572c6568c4fdf401b3ce922cbdfdb21b6f3132e/direction=expenditure/table=supplementary-12-pages-16-17-project_observations/data.parquet"
    }
  ]
}
