{
  "schema_version": 1,
  "target": {
    "jurisdiction": "132195",
    "fiscal_year": 2025,
    "document_kind": "supplementary",
    "amendment_number": 3
  },
  "direction": "expenditure",
  "tables": [
    {
      "table_id": "supplementary-detail-faa4d2cb8197a7c8",
      "raw_path": "supplementary-detail/jurisdiction=132195/year=2025/document_kind=supplementary/edition=19aab4991605e645daecf325def3f4f0807694446a1d0331e1d886c8c8aa8fe1/direction=expenditure/resource=supplementary-expenditure-project-setsu/data.parquet"
    }
  ]
}
