{
  "schema_version": 1,
  "target": {
    "jurisdiction": "132241",
    "fiscal_year": 2025,
    "document_kind": "supplementary",
    "amendment_number": 4
  },
  "direction": "expenditure",
  "tables": [
    {
      "table_id": "tama-supplementary-native-88f371f5625da729",
      "raw_path": "tama-supplementary-native/jurisdiction=132241/year=2025/document_kind=supplementary/edition=eea07329e6c3683d36989b3547719602800d34785b4693b1cd23aef5d5d1a454/direction=expenditure/table=supplementary-4-pages-196-207-observations/data.parquet"
    },
    {
      "table_id": "tama-supplementary-native-c84b749fd526487b",
      "raw_path": "tama-supplementary-native/jurisdiction=132241/year=2025/document_kind=supplementary/edition=eea07329e6c3683d36989b3547719602800d34785b4693b1cd23aef5d5d1a454/direction=expenditure/table=supplementary-4-pages-196-207-expenditure/data.parquet"
    },
    {
      "table_id": "tama-supplementary-native-2ad5f544f5cc307b",
      "raw_path": "tama-supplementary-native/jurisdiction=132241/year=2025/document_kind=supplementary/edition=eea07329e6c3683d36989b3547719602800d34785b4693b1cd23aef5d5d1a454/direction=expenditure/table=supplementary-4-pages-230-239-observations/data.parquet"
    },
    {
      "table_id": "tama-supplementary-native-9c2763419bde620b",
      "raw_path": "tama-supplementary-native/jurisdiction=132241/year=2025/document_kind=supplementary/edition=eea07329e6c3683d36989b3547719602800d34785b4693b1cd23aef5d5d1a454/direction=expenditure/table=supplementary-4-pages-230-239-expenditure/data.parquet"
    },
    {
      "table_id": "tama-supplementary-native-f48ea07d006829f8",
      "raw_path": "tama-supplementary-native/jurisdiction=132241/year=2025/document_kind=supplementary/edition=eea07329e6c3683d36989b3547719602800d34785b4693b1cd23aef5d5d1a454/direction=expenditure/table=supplementary-4-pages-254-257-observations/data.parquet"
    },
    {
      "table_id": "tama-supplementary-native-d3c79b4e5af25186",
      "raw_path": "tama-supplementary-native/jurisdiction=132241/year=2025/document_kind=supplementary/edition=eea07329e6c3683d36989b3547719602800d34785b4693b1cd23aef5d5d1a454/direction=expenditure/table=supplementary-4-pages-254-257-expenditure/data.parquet"
    },
    {
      "table_id": "tama-supplementary-native-2473838e61fb1565",
      "raw_path": "tama-supplementary-native/jurisdiction=132241/year=2025/document_kind=supplementary/edition=41c85cb60bafebd0176fe41b9365008c230db5370516bc2b49e7a8c2182ac4f6/direction=expenditure/table=supplementary-4-pages-18-37-observations/data.parquet"
    },
    {
      "table_id": "tama-supplementary-native-92335240e64e49c4",
      "raw_path": "tama-supplementary-native/jurisdiction=132241/year=2025/document_kind=supplementary/edition=41c85cb60bafebd0176fe41b9365008c230db5370516bc2b49e7a8c2182ac4f6/direction=expenditure/table=supplementary-4-pages-18-37-expenditure/data.parquet"
    }
  ]
}
