{
  "schema_version": 1,
  "target": {
    "jurisdiction": "132047",
    "fiscal_year": 2021,
    "document_kind": "settlement"
  },
  "direction": "expenditure",
  "tables": [
    {
      "table_id": "raw-2ae43f999552d835",
      "raw_path": "jurisdiction=132047/year=2021/document_kind=settlement/edition=15fdf95a79ab65a36ae9f01d25d5bf644f4784340294d37dcc2f1c2b43121fcc/direction=expenditure/data.parquet"
    }
  ]
}
