{
  "schema_version": 1,
  "target": {
    "jurisdiction": "132241",
    "fiscal_year": 2021,
    "document_kind": "initial"
  },
  "direction": "expenditure",
  "tables": [
    {
      "table_id": "raw-4fcc766d1754b23a",
      "raw_path": "jurisdiction=132241/year=2021/document_kind=budget/edition=84cecb682efb1b4aabf9e6235a512f10481181faee9934414204b90224c21757/direction=expenditure/data.parquet"
    },
    {
      "table_id": "raw-962f0d0cd7735a4a",
      "raw_path": "jurisdiction=132241/year=2021/document_kind=budget/edition=d1f90d5c0dcc607ddd4582b14b9c96681e5089dfee2664bca05a95ba075d1cf0/direction=expenditure/data.parquet"
    }
  ]
}
