{
  "schema_version": 1,
  "target": {
    "jurisdiction": "132047",
    "fiscal_year": 2021,
    "document_kind": "supplementary",
    "amendment_number": 8
  },
  "direction": "expenditure",
  "tables": [
    {
      "table_id": "mitaka-supplementary-native-fd71734a7bd0ead3",
      "raw_path": "mitaka-supplementary-native/jurisdiction=132047/year=2021/document_kind=supplementary/edition=29245a236c8d986fd2739d0d363f35543f68884f88e05c8324f67e1829106670/direction=expenditure/table=supplementary-8-pages-22-29-left_setsu_delta/data.parquet"
    },
    {
      "table_id": "mitaka-supplementary-native-f659c31076d8969a",
      "raw_path": "mitaka-supplementary-native/jurisdiction=132047/year=2021/document_kind=supplementary/edition=29245a236c8d986fd2739d0d363f35543f68884f88e05c8324f67e1829106670/direction=expenditure/table=supplementary-8-pages-22-29-left_setsu_observations/data.parquet"
    },
    {
      "table_id": "mitaka-supplementary-native-f44f3406e8391a5f",
      "raw_path": "mitaka-supplementary-native/jurisdiction=132047/year=2021/document_kind=supplementary/edition=29245a236c8d986fd2739d0d363f35543f68884f88e05c8324f67e1829106670/direction=expenditure/table=supplementary-8-pages-22-29-project_delta/data.parquet"
    },
    {
      "table_id": "mitaka-supplementary-native-0915d109ae3c3d7c",
      "raw_path": "mitaka-supplementary-native/jurisdiction=132047/year=2021/document_kind=supplementary/edition=29245a236c8d986fd2739d0d363f35543f68884f88e05c8324f67e1829106670/direction=expenditure/table=supplementary-8-pages-22-29-project_observations/data.parquet"
    }
  ]
}
