{
  "schema_version": 1,
  "target": {
    "jurisdiction": "132195",
    "fiscal_year": 2022,
    "document_kind": "supplementary",
    "amendment_number": 6
  },
  "direction": "expenditure",
  "tables": [
    {
      "table_id": "council-approved-detail-e338aec4dc04b818",
      "raw_path": "council-approved-detail/jurisdiction=132195/year=2022/document_kind=supplementary/edition=df633f80a4d268727cd832738c3e318d63d287b4de214e5ba28897833179a064/direction=expenditure/table=supplementary-expenditure-project-setsu-council-original-general-6/data.parquet"
    }
  ]
}
