{
  "schema_version": 1,
  "target": {
    "jurisdiction": "132195",
    "fiscal_year": 2021,
    "document_kind": "supplementary",
    "amendment_number": 11
  },
  "direction": "expenditure",
  "tables": [
    {
      "table_id": "held5-council-approved-detail-13853b845bb6b462",
      "raw_path": "held5-council-approved-detail/jurisdiction=132195/year=2021/document_kind=supplementary/edition=93de78d2f7c6c047ee802f785945c06acba8ef8b692e97755d35ce554d494558/direction=expenditure/table=supplementary-expenditure-project-setsu-held5-council-original-general-11/data.parquet"
    }
  ]
}
