{
  "schema_version": 1,
  "target": {
    "jurisdiction": "132241",
    "fiscal_year": 2025,
    "document_kind": "supplementary",
    "amendment_number": 12
  },
  "direction": "expenditure",
  "tables": [
    {
      "table_id": "tama-supplementary-native-9273845bfa5cd441",
      "raw_path": "tama-supplementary-native/jurisdiction=132241/year=2025/document_kind=supplementary/edition=3f08d804f340932c86d9c61b59ea53e05ae26f3663f5b5bdc159662e94d8c08e/direction=expenditure/table=supplementary-12-pages-10-11-observations/data.parquet"
    },
    {
      "table_id": "tama-supplementary-native-f4a23b5d85bc593f",
      "raw_path": "tama-supplementary-native/jurisdiction=132241/year=2025/document_kind=supplementary/edition=3f08d804f340932c86d9c61b59ea53e05ae26f3663f5b5bdc159662e94d8c08e/direction=expenditure/table=supplementary-12-pages-10-11-expenditure/data.parquet"
    }
  ]
}
