{
  "schema_version": 1,
  "target": {
    "jurisdiction": "132047",
    "fiscal_year": 2025,
    "document_kind": "supplementary",
    "amendment_number": 5
  },
  "direction": "expenditure",
  "tables": [
    {
      "table_id": "mitaka-supplementary-native-5ff029b3a5b4fbf5",
      "raw_path": "mitaka-supplementary-native/jurisdiction=132047/year=2025/document_kind=supplementary/edition=5a6f59cf5253b3632485b8221d7b57072fbdfd376cc404d57b578e24e1120f9e/direction=expenditure/table=supplementary-5-pages-20-27-left_setsu_delta/data.parquet"
    },
    {
      "table_id": "mitaka-supplementary-native-c2d713a13669c1d0",
      "raw_path": "mitaka-supplementary-native/jurisdiction=132047/year=2025/document_kind=supplementary/edition=5a6f59cf5253b3632485b8221d7b57072fbdfd376cc404d57b578e24e1120f9e/direction=expenditure/table=supplementary-5-pages-20-27-left_setsu_observations/data.parquet"
    },
    {
      "table_id": "mitaka-supplementary-native-ee61114c105d35da",
      "raw_path": "mitaka-supplementary-native/jurisdiction=132047/year=2025/document_kind=supplementary/edition=5a6f59cf5253b3632485b8221d7b57072fbdfd376cc404d57b578e24e1120f9e/direction=expenditure/table=supplementary-5-pages-20-27-project_delta/data.parquet"
    },
    {
      "table_id": "mitaka-supplementary-native-5225b34c788137d4",
      "raw_path": "mitaka-supplementary-native/jurisdiction=132047/year=2025/document_kind=supplementary/edition=5a6f59cf5253b3632485b8221d7b57072fbdfd376cc404d57b578e24e1120f9e/direction=expenditure/table=supplementary-5-pages-20-27-project_observations/data.parquet"
    }
  ]
}
