{
  "schema_version": 1,
  "target": {
    "jurisdiction": "132241",
    "fiscal_year": 2025,
    "document_kind": "initial"
  },
  "direction": "revenue",
  "tables": [
    {
      "table_id": "raw-962f0d0cd7735a4a",
      "raw_path": "jurisdiction=132241/year=2025/document_kind=budget/edition=9bf3db1296cc3862e6b9ba26542ea07b0f4b72ccc939c63a3df90fe7a0a176a1/direction=revenue/data.parquet"
    }
  ]
}
