{
  "schema_version": 1,
  "target": {
    "jurisdiction": "132241",
    "fiscal_year": 2024,
    "document_kind": "supplementary",
    "amendment_number": 8
  },
  "direction": "expenditure",
  "tables": [
    {
      "table_id": "tama-supplementary-native-da9c6af53001f79c",
      "raw_path": "tama-supplementary-native/jurisdiction=132241/year=2024/document_kind=supplementary/edition=514b74f3e3aaa132c527c7546331743347aada1b6efbb29f236f9cc4884e8832/direction=expenditure/table=supplementary-8-pages-12-35-observations/data.parquet"
    },
    {
      "table_id": "tama-supplementary-native-5388758445cd0d37",
      "raw_path": "tama-supplementary-native/jurisdiction=132241/year=2024/document_kind=supplementary/edition=514b74f3e3aaa132c527c7546331743347aada1b6efbb29f236f9cc4884e8832/direction=expenditure/table=supplementary-8-pages-12-35-expenditure/data.parquet"
    }
  ]
}
