{
  "schema_version": 1,
  "target": {
    "jurisdiction": "132047",
    "fiscal_year": 2024,
    "document_kind": "supplementary",
    "amendment_number": 6
  },
  "direction": "expenditure",
  "tables": [
    {
      "table_id": "mitaka-supplementary-native-a07c8a6dd9276f04",
      "raw_path": "mitaka-supplementary-native/jurisdiction=132047/year=2024/document_kind=supplementary/edition=e187a8e886f7f6b5aba1486d4c478f98544ec3fffb9f1ba9c3e183337208c0ca/direction=expenditure/table=supplementary-6-pages-16-21-left_setsu_delta/data.parquet"
    },
    {
      "table_id": "mitaka-supplementary-native-e34a01a1045b0b75",
      "raw_path": "mitaka-supplementary-native/jurisdiction=132047/year=2024/document_kind=supplementary/edition=e187a8e886f7f6b5aba1486d4c478f98544ec3fffb9f1ba9c3e183337208c0ca/direction=expenditure/table=supplementary-6-pages-16-21-left_setsu_observations/data.parquet"
    },
    {
      "table_id": "mitaka-supplementary-native-494a6b69f5d6f8c0",
      "raw_path": "mitaka-supplementary-native/jurisdiction=132047/year=2024/document_kind=supplementary/edition=e187a8e886f7f6b5aba1486d4c478f98544ec3fffb9f1ba9c3e183337208c0ca/direction=expenditure/table=supplementary-6-pages-16-21-project_delta/data.parquet"
    },
    {
      "table_id": "mitaka-supplementary-native-c5ee18178bdbbdcf",
      "raw_path": "mitaka-supplementary-native/jurisdiction=132047/year=2024/document_kind=supplementary/edition=e187a8e886f7f6b5aba1486d4c478f98544ec3fffb9f1ba9c3e183337208c0ca/direction=expenditure/table=supplementary-6-pages-16-21-project_observations/data.parquet"
    }
  ]
}
