{
  "schema_version": 1,
  "target": {
    "jurisdiction": "132047",
    "fiscal_year": 2023,
    "document_kind": "supplementary",
    "amendment_number": 8
  },
  "direction": "expenditure",
  "tables": [
    {
      "table_id": "mitaka-supplementary-native-c009f47404bf8a11",
      "raw_path": "mitaka-supplementary-native/jurisdiction=132047/year=2023/document_kind=supplementary/edition=a7deb89e3ed23b1b5f14abaa8704d5dc6b67e8214270a145d27e917bac06ffd6/direction=expenditure/table=supplementary-8-pages-20-23-left_setsu_delta/data.parquet"
    },
    {
      "table_id": "mitaka-supplementary-native-cb08022b7353c040",
      "raw_path": "mitaka-supplementary-native/jurisdiction=132047/year=2023/document_kind=supplementary/edition=a7deb89e3ed23b1b5f14abaa8704d5dc6b67e8214270a145d27e917bac06ffd6/direction=expenditure/table=supplementary-8-pages-20-23-left_setsu_observations/data.parquet"
    },
    {
      "table_id": "mitaka-supplementary-native-b5b28cea34e7d405",
      "raw_path": "mitaka-supplementary-native/jurisdiction=132047/year=2023/document_kind=supplementary/edition=a7deb89e3ed23b1b5f14abaa8704d5dc6b67e8214270a145d27e917bac06ffd6/direction=expenditure/table=supplementary-8-pages-20-23-project_delta/data.parquet"
    },
    {
      "table_id": "mitaka-supplementary-native-be7297403362ac94",
      "raw_path": "mitaka-supplementary-native/jurisdiction=132047/year=2023/document_kind=supplementary/edition=a7deb89e3ed23b1b5f14abaa8704d5dc6b67e8214270a145d27e917bac06ffd6/direction=expenditure/table=supplementary-8-pages-20-23-project_observations/data.parquet"
    }
  ]
}
