{
  "schema_version": 1,
  "target": {
    "jurisdiction": "132071",
    "fiscal_year": 2022,
    "document_kind": "settlement"
  },
  "direction": "expenditure",
  "tables": [
    {
      "table_id": "akishima-settlement2020-2023-d1a2e005b1e2428e",
      "raw_path": "akishima-settlement2020-2023/jurisdiction=132071/year=2022/document_kind=settlement/edition=19b9f62e009d35d220c39e7c780f9d6200b6ad26ba9bcffccdc3853089ec07bf/direction=expenditure/table=fy2022-general-financial/data.parquet"
    },
    {
      "table_id": "akishima-settlement2020-2023-6bc579a826ee6d17",
      "raw_path": "akishima-settlement2020-2023/jurisdiction=132071/year=2022/document_kind=settlement/edition=19b9f62e009d35d220c39e7c780f9d6200b6ad26ba9bcffccdc3853089ec07bf/direction=expenditure/table=fy2022-general-controls/data.parquet"
    },
    {
      "table_id": "akishima-settlement2020-2023-f2bbddaf890263f0",
      "raw_path": "akishima-settlement2020-2023/jurisdiction=132071/year=2022/document_kind=settlement/edition=19b9f62e009d35d220c39e7c780f9d6200b6ad26ba9bcffccdc3853089ec07bf/direction=expenditure/table=fy2022-general-projects/data.parquet"
    },
    {
      "table_id": "akishima-settlement2020-2023-63489a841dd31ec3",
      "raw_path": "akishima-settlement2020-2023/jurisdiction=132071/year=2022/document_kind=settlement/edition=19b9f62e009d35d220c39e7c780f9d6200b6ad26ba9bcffccdc3853089ec07bf/direction=expenditure/table=fy2022-health-financial/data.parquet"
    },
    {
      "table_id": "akishima-settlement2020-2023-9178b053b387e43d",
      "raw_path": "akishima-settlement2020-2023/jurisdiction=132071/year=2022/document_kind=settlement/edition=19b9f62e009d35d220c39e7c780f9d6200b6ad26ba9bcffccdc3853089ec07bf/direction=expenditure/table=fy2022-health-controls/data.parquet"
    },
    {
      "table_id": "akishima-settlement2020-2023-e56f78254186d102",
      "raw_path": "akishima-settlement2020-2023/jurisdiction=132071/year=2022/document_kind=settlement/edition=19b9f62e009d35d220c39e7c780f9d6200b6ad26ba9bcffccdc3853089ec07bf/direction=expenditure/table=fy2022-health-projects/data.parquet"
    },
    {
      "table_id": "akishima-settlement2020-2023-3724ca589df17b57",
      "raw_path": "akishima-settlement2020-2023/jurisdiction=132071/year=2022/document_kind=settlement/edition=19b9f62e009d35d220c39e7c780f9d6200b6ad26ba9bcffccdc3853089ec07bf/direction=expenditure/table=fy2022-care-financial/data.parquet"
    },
    {
      "table_id": "akishima-settlement2020-2023-bcae6e72b34f3c91",
      "raw_path": "akishima-settlement2020-2023/jurisdiction=132071/year=2022/document_kind=settlement/edition=19b9f62e009d35d220c39e7c780f9d6200b6ad26ba9bcffccdc3853089ec07bf/direction=expenditure/table=fy2022-care-controls/data.parquet"
    },
    {
      "table_id": "akishima-settlement2020-2023-2c80f6d0f33c14d6",
      "raw_path": "akishima-settlement2020-2023/jurisdiction=132071/year=2022/document_kind=settlement/edition=19b9f62e009d35d220c39e7c780f9d6200b6ad26ba9bcffccdc3853089ec07bf/direction=expenditure/table=fy2022-care-projects/data.parquet"
    },
    {
      "table_id": "akishima-settlement2020-2023-6dca064a31e97c25",
      "raw_path": "akishima-settlement2020-2023/jurisdiction=132071/year=2022/document_kind=settlement/edition=19b9f62e009d35d220c39e7c780f9d6200b6ad26ba9bcffccdc3853089ec07bf/direction=expenditure/table=fy2022-elderly-financial/data.parquet"
    },
    {
      "table_id": "akishima-settlement2020-2023-674b5195dfa0577e",
      "raw_path": "akishima-settlement2020-2023/jurisdiction=132071/year=2022/document_kind=settlement/edition=19b9f62e009d35d220c39e7c780f9d6200b6ad26ba9bcffccdc3853089ec07bf/direction=expenditure/table=fy2022-elderly-controls/data.parquet"
    },
    {
      "table_id": "akishima-settlement2020-2023-2ebe7596ef520279",
      "raw_path": "akishima-settlement2020-2023/jurisdiction=132071/year=2022/document_kind=settlement/edition=19b9f62e009d35d220c39e7c780f9d6200b6ad26ba9bcffccdc3853089ec07bf/direction=expenditure/table=fy2022-elderly-projects/data.parquet"
    },
    {
      "table_id": "akishima-settlement2020-2023-b7f30eaf7ac8a922",
      "raw_path": "akishima-settlement2020-2023/jurisdiction=132071/year=2022/document_kind=settlement/edition=19b9f62e009d35d220c39e7c780f9d6200b6ad26ba9bcffccdc3853089ec07bf/direction=expenditure/table=fy2022-land-financial/data.parquet"
    },
    {
      "table_id": "akishima-settlement2020-2023-c812f5f2057f8c7c",
      "raw_path": "akishima-settlement2020-2023/jurisdiction=132071/year=2022/document_kind=settlement/edition=19b9f62e009d35d220c39e7c780f9d6200b6ad26ba9bcffccdc3853089ec07bf/direction=expenditure/table=fy2022-land-controls/data.parquet"
    },
    {
      "table_id": "akishima-settlement2020-2023-87f1c69e9039f0c7",
      "raw_path": "akishima-settlement2020-2023/jurisdiction=132071/year=2022/document_kind=settlement/edition=19b9f62e009d35d220c39e7c780f9d6200b6ad26ba9bcffccdc3853089ec07bf/direction=expenditure/table=fy2022-land-projects/data.parquet"
    },
    {
      "table_id": "akishima-settlement2020-2023-bef3c4312595384d",
      "raw_path": "akishima-settlement2020-2023/jurisdiction=132071/year=2022/document_kind=settlement/edition=19b9f62e009d35d220c39e7c780f9d6200b6ad26ba9bcffccdc3853089ec07bf/direction=expenditure/table=fy2022-all-controls/data.parquet"
    }
  ]
}
