{
  "schema_version": 1,
  "target": {
    "jurisdiction": "132047",
    "fiscal_year": 2018,
    "document_kind": "settlement"
  },
  "direction": "revenue",
  "tables": [
    {
      "table_id": "raw-2ae43f999552d835",
      "raw_path": "jurisdiction=132047/year=2018/document_kind=settlement/edition=fbc0b963bba349ec735af87949a77506bd1e5ab45669df84e595f8974b456462/direction=revenue/data.parquet"
    }
  ]
}
