{
  "schema_version": 1,
  "target": {
    "jurisdiction": "132047",
    "fiscal_year": 2019,
    "document_kind": "initial"
  },
  "direction": "expenditure",
  "tables": [
    {
      "table_id": "raw-2ae43f999552d835",
      "raw_path": "jurisdiction=132047/year=2019/document_kind=budget/edition=623f840033f29b3a972567a5910731286a6c0fec8d34830e4de00e839dd39bff/direction=expenditure/data.parquet"
    }
  ]
}
