{
  "schema_version": 1,
  "target": {
    "jurisdiction": "132241",
    "fiscal_year": 2024,
    "document_kind": "supplementary",
    "amendment_number": 11
  },
  "direction": "expenditure",
  "tables": [
    {
      "table_id": "tama-supplementary-native-f804150617e341f4",
      "raw_path": "tama-supplementary-native/jurisdiction=132241/year=2024/document_kind=supplementary/edition=5764a9345e85236c4a3acad6861471f61f085a5273f31b0b83c1a0f93db084b7/direction=expenditure/table=supplementary-11-pages-10-13-observations/data.parquet"
    },
    {
      "table_id": "tama-supplementary-native-6458b7a0359ebbab",
      "raw_path": "tama-supplementary-native/jurisdiction=132241/year=2024/document_kind=supplementary/edition=5764a9345e85236c4a3acad6861471f61f085a5273f31b0b83c1a0f93db084b7/direction=expenditure/table=supplementary-11-pages-10-13-expenditure/data.parquet"
    }
  ]
}
