{
  "schema_version": 1,
  "target": {
    "jurisdiction": "132241",
    "fiscal_year": 2025,
    "document_kind": "supplementary",
    "amendment_number": 10
  },
  "direction": "expenditure",
  "tables": [
    {
      "table_id": "tama-supplementary-native-91de6b023fbb689a",
      "raw_path": "tama-supplementary-native/jurisdiction=132241/year=2025/document_kind=supplementary/edition=284b01d7729231209823705b4ef14548b8f48b3bd26ba986e59faacf6311dd8a/direction=expenditure/table=supplementary-10-pages-10-11-observations/data.parquet"
    },
    {
      "table_id": "tama-supplementary-native-6ec4c85c2ff96444",
      "raw_path": "tama-supplementary-native/jurisdiction=132241/year=2025/document_kind=supplementary/edition=284b01d7729231209823705b4ef14548b8f48b3bd26ba986e59faacf6311dd8a/direction=expenditure/table=supplementary-10-pages-10-11-expenditure/data.parquet"
    }
  ]
}
