{
  "schema_version": 1,
  "target": {
    "jurisdiction": "132047",
    "fiscal_year": 2021,
    "document_kind": "supplementary",
    "amendment_number": 15
  },
  "direction": "expenditure",
  "tables": [
    {
      "table_id": "mitaka-supplementary-native-a1e68a7fa5291c3f",
      "raw_path": "mitaka-supplementary-native/jurisdiction=132047/year=2021/document_kind=supplementary/edition=9d8be9bba808e01e3b9fa929101f3a76f89e192ee506650824062a54e2151200/direction=expenditure/table=supplementary-15-pages-16-17-left_setsu_delta/data.parquet"
    },
    {
      "table_id": "mitaka-supplementary-native-f9a7d104f8c256a4",
      "raw_path": "mitaka-supplementary-native/jurisdiction=132047/year=2021/document_kind=supplementary/edition=9d8be9bba808e01e3b9fa929101f3a76f89e192ee506650824062a54e2151200/direction=expenditure/table=supplementary-15-pages-16-17-left_setsu_observations/data.parquet"
    },
    {
      "table_id": "mitaka-supplementary-native-60c209ef6abc1c0c",
      "raw_path": "mitaka-supplementary-native/jurisdiction=132047/year=2021/document_kind=supplementary/edition=9d8be9bba808e01e3b9fa929101f3a76f89e192ee506650824062a54e2151200/direction=expenditure/table=supplementary-15-pages-16-17-project_delta/data.parquet"
    },
    {
      "table_id": "mitaka-supplementary-native-4b7e1fda5167fb96",
      "raw_path": "mitaka-supplementary-native/jurisdiction=132047/year=2021/document_kind=supplementary/edition=9d8be9bba808e01e3b9fa929101f3a76f89e192ee506650824062a54e2151200/direction=expenditure/table=supplementary-15-pages-16-17-project_observations/data.parquet"
    }
  ]
}
